{
  "$schema": "https://json-schema.org/draft/2020-12/schema",
  "$id": "urn:mosa:schemas:object-dossier-packet:1",
  "title": "MoSA object dossier packet",
  "description": "A validated packet of object dossiers for the transactional importer (ADR 012). Records are referenced by symbolic local keys; canonical UUIDs are always generated by PostgreSQL and never appear in a packet.",
  "type": "object",
  "additionalProperties": false,
  "required": ["schemaVersion", "dataset", "objects", "agents", "places", "sources", "claims"],
  "properties": {
    "schemaVersion": {
      "const": 1
    },
    "dataset": {
      "type": "object",
      "additionalProperties": false,
      "required": ["key", "version"],
      "properties": {
        "key": {
          "description": "Stable logical identifier for this packet lineage across repeated imports, for example mosa-bootstrap.",
          "type": "string",
          "pattern": "^[a-z0-9][a-z0-9-]*$"
        },
        "version": {
          "description": "Human-readable packet version, for example a date or sequence number.",
          "type": "string",
          "minLength": 1
        },
        "title": {
          "type": "string",
          "minLength": 1
        }
      }
    },
    "objects": {
      "type": "array",
      "items": { "$ref": "#/$defs/object" }
    },
    "agents": {
      "type": "array",
      "items": { "$ref": "#/$defs/agent" }
    },
    "places": {
      "type": "array",
      "items": { "$ref": "#/$defs/place" }
    },
    "sources": {
      "type": "array",
      "items": { "$ref": "#/$defs/source" }
    },
    "claims": {
      "type": "array",
      "items": { "$ref": "#/$defs/claim" }
    }
  },
  "$defs": {
    "localKey": {
      "description": "Symbolic packet-local key, for example item:hoa-hakananai-a. Keys are opaque; entity type is determined by the array a record appears in.",
      "type": "string",
      "pattern": "^\\S+(?: \\S+)*$",
      "minLength": 1
    },
    "kind": {
      "type": "string",
      "pattern": "^\\S+(?:\\s\\S+)*$",
      "minLength": 1
    },
    "object": {
      "type": "object",
      "additionalProperties": false,
      "required": ["key"],
      "properties": {
        "key": { "$ref": "#/$defs/localKey" },
        "kind": {
          "description": "Item kind, for example artefact or ancestral_remains.",
          "$ref": "#/$defs/kind"
        },
        "externalIdentifiers": {
          "type": "array",
          "items": {
            "type": "object",
            "additionalProperties": false,
            "required": ["namespace", "value"],
            "properties": {
              "namespace": {
                "description": "The assigning system or institution, for example british-museum.",
                "type": "string",
                "pattern": "^[a-z0-9][a-z0-9-]*$"
              },
              "value": {
                "type": "string",
                "minLength": 1
              },
              "source": {
                "description": "Optional local key of the packet source establishing or displaying this identifier.",
                "$ref": "#/$defs/localKey"
              }
            }
          }
        }
      }
    },
    "agent": {
      "type": "object",
      "additionalProperties": false,
      "required": ["key"],
      "properties": {
        "key": { "$ref": "#/$defs/localKey" },
        "kind": {
          "description": "Agent kind, for example person or organisation.",
          "$ref": "#/$defs/kind"
        }
      }
    },
    "place": {
      "type": "object",
      "additionalProperties": false,
      "required": ["key"],
      "properties": {
        "key": { "$ref": "#/$defs/localKey" },
        "kind": {
          "description": "Place kind, for example city, site or volcano.",
          "$ref": "#/$defs/kind"
        }
      }
    },
    "source": {
      "type": "object",
      "additionalProperties": false,
      "required": ["key", "kind", "url", "retrievedAt"],
      "properties": {
        "key": { "$ref": "#/$defs/localKey" },
        "kind": {
          "description": "Source kind, for example institutional_record or webpage.",
          "$ref": "#/$defs/kind"
        },
        "url": {
          "description": "Absolute HTTP or HTTPS URL of the source. Stored as entities.source.reference.",
          "type": "string",
          "pattern": "^https?://\\S+$"
        },
        "retrievedAt": {
          "description": "When the source was retrieved or last checked. The importer preserves the original timestamp on reruns.",
          "type": "string",
          "format": "date-time"
        },
        "about": {
          "description": "Local keys of the packet objects this source concerns. Each entry becomes a source refers_to object claim.",
          "type": "array",
          "items": { "$ref": "#/$defs/localKey" }
        },
        "assertedBy": {
          "description": "Optional local key of the agent asserting the derived refers_to claims.",
          "$ref": "#/$defs/localKey"
        }
      }
    },
    "textLiteral": {
      "type": "object",
      "additionalProperties": false,
      "required": ["type", "value"],
      "properties": {
        "type": { "const": "text" },
        "value": {
          "type": "string",
          "minLength": 1
        },
        "language": {
          "description": "Optional BCP 47 / ISO 639 language tag, for example en or rap.",
          "type": "string",
          "minLength": 2
        }
      }
    },
    "evidence": {
      "type": "object",
      "additionalProperties": false,
      "required": ["key", "source", "relationship", "locator"],
      "properties": {
        "key": { "$ref": "#/$defs/localKey" },
        "source": {
          "description": "Local key of the packet source providing this evidence.",
          "$ref": "#/$defs/localKey"
        },
        "relationship": {
          "enum": ["supports", "contradicts", "qualifies", "mentions", "provides_context"]
        },
        "locator": {
          "description": "Where in the source the evidence sits, for example a field name, page or timestamp.",
          "type": "string",
          "minLength": 1
        },
        "excerpt": {
          "description": "The relevant source wording. May be omitted only for visual sources or whole-document evidence.",
          "type": "string",
          "minLength": 1
        }
      }
    },
    "claim": {
      "type": "object",
      "additionalProperties": false,
      "required": ["key", "subject", "predicate", "evidence"],
      "properties": {
        "key": { "$ref": "#/$defs/localKey" },
        "subject": { "$ref": "#/$defs/localKey" },
        "predicate": {
          "description": "Version 1 supports only these summary predicates. Source refers_to relationships are derived from source.about, not written here.",
          "enum": ["has_name", "made_at", "found_at", "located_at", "held_by"]
        },
        "object": {
          "description": "Local key of the claim value entity. Exactly one of object or literal must be present.",
          "$ref": "#/$defs/localKey"
        },
        "literal": { "$ref": "#/$defs/textLiteral" },
        "assertedBy": {
          "description": "Optional local key of the agent represented as making the assertion.",
          "$ref": "#/$defs/localKey"
        },
        "evidence": {
          "anyOf": [
            { "$ref": "#/$defs/evidence" },
            {
              "type": "array",
              "minItems": 1,
              "items": { "$ref": "#/$defs/evidence" }
            }
          ]
        }
      },
      "oneOf": [
        { "required": ["object"], "not": { "required": ["literal"] } },
        { "required": ["literal"], "not": { "required": ["object"] } }
      ]
    }
  }
}
